{
  "Requirement ID": "R010",
  "Title": "PID for data citation",
  "Description": "Data that are accessed through the federation need to have a PID (for example doi) to support 1) review by the original data provider's team and 2) credit attribution to the original data generator (e.g., co-authorship / acknowledgement in publications)",
  "Version": "MS8 - updated",
  "Status": "Baselined",
  "Priority": 2,
  "Source": "EOSC-ENTRUST Driver 2",
  "Rationale": "",
  "Category": "Data Lifecycle, Quality and FAIRness",
  "Clarification Notes": "",
  "Scope Attribution": "",
  "Related Requirements": [],
  "Framework Mappings": [
    {
      "frameworkId": "SATRE",
      "value": "not included"
    },
    {
      "frameworkId": "ENTRUST Blueprint",
      "value": "Federation Services - Registry->Datasets"
    }
  ]
}