{
  "Requirement ID": "R054",
  "Title": "Logging and auditing support",
  "Description": "Support for querying and filtering audit logs through intuitive user interfaces (dashboards, reports, alerts).",
  "Version": "MS8",
  "Status": "Baselined",
  "Priority": 2,
  "Source": "EOSC-ENTRUST Driver 1",
  "Rationale": "",
  "Category": "Security, AAAI and Output Control",
  "Clarification Notes": "",
  "Scope Attribution": "",
  "Related Requirements": [],
  "Framework Mappings": [
    {
      "frameworkId": "SATRE",
      "value": ""
    },
    {
      "frameworkId": "ENTRUST Blueprint",
      "value": "Federation Services - AAAI - Auditing"
    }
  ]
}