{
  "Requirement ID": "R024",
  "Title": "2-factor authentication for TRE users",
  "Description": "2-factor authentication is a critical security measure in TREs to ensure that only authorized individuals can access sensitive data. E.g. username and password + OTP.",
  "Version": "M7",
  "Status": "Baselined",
  "Priority": 2,
  "Source": "EOSC-ENTRUST Driver 3",
  "Rationale": "",
  "Category": "Security, AAAI and Output Control",
  "Clarification Notes": "",
  "Scope Attribution": "",
  "Related Requirements": [],
  "Framework Mappings": [
    {
      "frameworkId": "SATRE",
      "value": "Identity and access management"
    },
    {
      "frameworkId": "ENTRUST Blueprint",
      "value": "Federation Services - AAAI - Authentication"
    }
  ]
}