{
  "Requirement ID": "R023",
  "Title": "(Meta-)data quality checks/standards",
  "Description": "Could implement a data quality framework to be recommended to data providers. Must have metadata quality checks. Clinical trial data is already of good quality due to rigorous processes, regulations, audits that come with the conduct of a trial. A data quality label could be useful for data coming from healthcare if we want them to be used in clinical trials for regulatory submissions.",
  "Version": "M7",
  "Status": "Baselined",
  "Priority": 1,
  "Source": "EOSC-ENTRUST Driver 3",
  "Rationale": "",
  "Category": "Data Lifecycle, Quality and FAIRness",
  "Clarification Notes": "",
  "Scope Attribution": "",
  "Related Requirements": [],
  "Framework Mappings": [
    {
      "frameworkId": "SATRE",
      "value": "Quality Management"
    },
    {
      "frameworkId": "ENTRUST Blueprint",
      "value": "Discovery Service"
    }
  ]
}