{
  "Requirement ID": "R012",
  "Title": "Metadata",
  "Description": "Metadata available in one language (English)",
  "Version": "M7",
  "Status": "Baselined",
  "Priority": 2,
  "Source": "EOSC-ENTRUST Driver 2",
  "Rationale": "",
  "Category": "Data Lifecycle, Quality and FAIRness",
  "Clarification Notes": "",
  "Scope Attribution": "",
  "Related Requirements": [],
  "Framework Mappings": [
    {
      "frameworkId": "SATRE",
      "value": "Research Meta-Data"
    },
    {
      "frameworkId": "ENTRUST Blueprint",
      "value": "Discovery Service"
    }
  ]
}