{
  "Requirement ID": "R046",
  "Title": "Authentication of diverse user groups",
  "Description": "Authenticating non-European users who don\u2019t have eIDAS and users from member states where national regulations do not support eID (or there are restrictions from which countries within EU are trusted)\n",
  "Version": "MS8",
  "Status": "Baselined",
  "Priority": 1,
  "Source": "EOSC-ENTRUST Driver 4",
  "Rationale": "",
  "Category": "Security, AAAI and Output Control",
  "Clarification Notes": "",
  "Scope Attribution": "",
  "Related Requirements": [],
  "Framework Mappings": [
    {
      "frameworkId": "SATRE",
      "value": ""
    },
    {
      "frameworkId": "ENTRUST Blueprint",
      "value": "Federation Services - AAAI - Authentication"
    }
  ]
}