{
  "Requirement ID": "R049",
  "Title": "Data import checks",
  "Description": "Checks to ensure own/external data import request is included in project application",
  "Version": "MS8",
  "Status": "Baselined",
  "Priority": 0,
  "Source": "EOSC-ENTRUST Driver 2",
  "Rationale": "",
  "Category": "Security, AAAI and Output Control",
  "Clarification Notes": "",
  "Scope Attribution": "",
  "Related Requirements": [],
  "Framework Mappings": [
    {
      "frameworkId": "SATRE",
      "value": ""
    },
    {
      "frameworkId": "ENTRUST Blueprint",
      "value": "TRE - RAZ"
    }
  ]
}