{
  "Requirement ID": "R042",
  "Title": "Standardized terminology",
  "Description": "Standardised terminology is needed across the Blueprint, ideally externally published so they can be referred to in the community",
  "Version": "MS8",
  "Status": "Baselined",
  "Priority": 2,
  "Source": "EOSC-ENTRUST Driver 2",
  "Rationale": "",
  "Category": "Data Lifecycle, Quality and FAIRness",
  "Clarification Notes": "",
  "Scope Attribution": "",
  "Related Requirements": [],
  "Framework Mappings": [
    {
      "frameworkId": "SATRE",
      "value": ""
    },
    {
      "frameworkId": "ENTRUST Blueprint",
      "value": "Blueprint"
    }
  ]
}