{
  "Requirement ID": "R013",
  "Title": "Output release following SDC",
  "Description": "Output release following SDC checks performed by the TRE, should have clear SDC rules that are consistent with recognised best practice",
  "Version": "MS8 - updated",
  "Status": "Baselined",
  "Priority": 2,
  "Source": "EOSC-ENTRUST Driver 2",
  "Rationale": "",
  "Category": "Security, AAAI and Output Control",
  "Clarification Notes": "",
  "Scope Attribution": "",
  "Related Requirements": [],
  "Framework Mappings": [
    {
      "frameworkId": "SATRE",
      "value": "Output management"
    },
    {
      "frameworkId": "ENTRUST Blueprint",
      "value": "TRE - Output control"
    }
  ]
}