{
  "Requirement ID": "R050",
  "Title": "Identity freshness check",
  "Description": "Freshness of identity information of a user logging in to a TRE or the federation should be checked",
  "Version": "MS8",
  "Status": "Baselined",
  "Priority": 0,
  "Source": "EOSC-ENTRUST Driver 4",
  "Rationale": "",
  "Category": "Security, AAAI and Output Control",
  "Clarification Notes": "",
  "Scope Attribution": "",
  "Related Requirements": [],
  "Framework Mappings": [
    {
      "frameworkId": "SATRE",
      "value": ""
    },
    {
      "frameworkId": "ENTRUST Blueprint",
      "value": "Federation Services - AAAI - Authentication"
    }
  ]
}