{
  "Requirement ID": "R070",
  "Title": "Federated output control definition",
  "Description": "Define and implement output control for federated analyses involving multiple TREs.",
  "Version": "MS8",
  "Status": "Baselined",
  "Priority": 0,
  "Source": "EOSC-ENTRUST Driver 3",
  "Rationale": "",
  "Category": "Security, AAAI and Output Control",
  "Clarification Notes": "",
  "Scope Attribution": "",
  "Related Requirements": [],
  "Framework Mappings": [
    {
      "frameworkId": "SATRE",
      "value": ""
    },
    {
      "frameworkId": "ENTRUST Blueprint",
      "value": "TRE - Output control"
    }
  ]
}