{
  "Requirement ID": "R001",
  "Title": "Data Encryption in transit",
  "Description": "All data within the Trusted Research Environment must be encrypted in transit. This requirement aims to ensure that data is protected from unauthorized access or breaches.",
  "Version": "M7",
  "Status": "Baselined",
  "Priority": 3,
  "Source": "EOSC-ENTRUST Driver 1",
  "Rationale": "",
  "Category": "Security, AAAI and Output Control",
  "Clarification Notes": "",
  "Scope Attribution": "",
  "Related Requirements": [],
  "Framework Mappings": [
    {
      "frameworkId": "SATRE",
      "value": "Information security"
    },
    {
      "frameworkId": "ENTRUST Blueprint",
      "value": "TRE - Security Server"
    }
  ]
}