{
  "Requirement ID": "R057",
  "Title": "Governance checks",
  "Description": "Integration of robust governance checks at multiple stages (submission, intermediate result generation, result aggregation) without creating massive bottlenecks.",
  "Version": "MS8",
  "Status": "Baselined",
  "Priority": 0,
  "Source": "EOSC-ENTRUST Driver 1",
  "Rationale": "",
  "Category": "Security, AAAI and Output Control",
  "Clarification Notes": "",
  "Scope Attribution": "",
  "Related Requirements": [],
  "Framework Mappings": [
    {
      "frameworkId": "SATRE",
      "value": ""
    },
    {
      "frameworkId": "ENTRUST Blueprint",
      "value": "TRE - Output control"
    }
  ]
}