{
  "Requirement ID": "R072",
  "Title": "Reconcile terminology & data standards",
  "Description": "Develop processes to reconcile differences in clinical terminology and data standards (e.g., MedDRA vs ICD-10; CDISC vs OMOP).",
  "Version": "MS8",
  "Status": "Baselined",
  "Priority": 0,
  "Source": "EOSC-ENTRUST Driver 3",
  "Rationale": "",
  "Category": "Data Lifecycle, Quality and FAIRness",
  "Clarification Notes": "",
  "Scope Attribution": "",
  "Related Requirements": [],
  "Framework Mappings": [
    {
      "frameworkId": "SATRE",
      "value": ""
    },
    {
      "frameworkId": "ENTRUST Blueprint",
      "value": "Federation Services - not included"
    }
  ]
}