{
  "Requirement ID": "R022",
  "Title": "Metadata",
  "Description": "For clinical trials, all data objects within a Trusted Research Environment must have detailed metadata describing both the clinical study that generated them and each data object individually. Metadata should cover as a minimum discovery, access and provenance.",
  "Version": "M7",
  "Status": "Baselined",
  "Priority": 2,
  "Source": "EOSC-ENTRUST Driver 3",
  "Rationale": "",
  "Category": "Data Lifecycle, Quality and FAIRness",
  "Clarification Notes": "",
  "Scope Attribution": "",
  "Related Requirements": [],
  "Framework Mappings": [
    {
      "frameworkId": "SATRE",
      "value": "Meta-Data Search and Discovery Application"
    },
    {
      "frameworkId": "ENTRUST Blueprint",
      "value": "Discovery Service"
    }
  ]
}