{
  "Requirement ID": "R056",
  "Title": "Standard workflows",
  "Description": "Federation-wide acceptance of workflows.",
  "Version": "MS8",
  "Status": "Baselined",
  "Priority": 0,
  "Source": "EOSC-ENTRUST Driver 1",
  "Rationale": "",
  "Category": "Federation, Usability, and Advanced Capabilities",
  "Clarification Notes": "",
  "Scope Attribution": "",
  "Related Requirements": [],
  "Framework Mappings": [
    {
      "frameworkId": "SATRE",
      "value": ""
    },
    {
      "frameworkId": "ENTRUST Blueprint",
      "value": "Software service - Software applications"
    }
  ]
}