{
  "Requirement ID": "R015",
  "Title": "Data transfer between environments",
  "Description": "To benefit data pooling model of federated analysis",
  "Version": "MS8 - updated",
  "Status": "Baselined",
  "Priority": 1,
  "Source": "EOSC-ENTRUST Driver 2",
  "Rationale": "",
  "Category": "Federation, Usability, and Advanced Capabilities",
  "Clarification Notes": "",
  "Scope Attribution": "",
  "Related Requirements": [],
  "Framework Mappings": [
    {
      "frameworkId": "SATRE",
      "value": "not included"
    },
    {
      "frameworkId": "ENTRUST Blueprint",
      "value": "Job submission service"
    }
  ]
}