{
  "Requirement ID": "R047",
  "Title": "Training included in digital identity",
  "Description": "Ideally, having the ability to record training would be included in the AAAI solution - i.e. like a type of \u2018Researcher Passport\u2019. The AAAI would need to talk to multiple training systems and would need to be queryable.  \n",
  "Version": "MS8",
  "Status": "Baselined",
  "Priority": 1,
  "Source": "EOSC-ENTRUST Driver 2",
  "Rationale": "",
  "Category": "Data Lifecycle, Quality and FAIRness",
  "Clarification Notes": "",
  "Scope Attribution": "",
  "Related Requirements": [],
  "Framework Mappings": [
    {
      "frameworkId": "SATRE",
      "value": ""
    },
    {
      "frameworkId": "ENTRUST Blueprint",
      "value": "Federation Services - AAAI - Authorization"
    }
  ]
}