{
  "Requirement ID": "R030",
  "Title": "Data (Cohort) Discovery",
  "Description": "A, perhaps automated, process for identifying suitable data for a research project or clinical trial. Might be federated to allow for multi-TRE querying (See HDR Cohort Discovery Tool). Should be in a unified service portal",
  "Version": "MS8 - updated",
  "Status": "Baselined",
  "Priority": 1,
  "Source": "EOSC-ENTRUST Driver 3",
  "Rationale": "",
  "Category": "Data Lifecycle, Quality and FAIRness",
  "Clarification Notes": "",
  "Scope Attribution": "",
  "Related Requirements": [],
  "Framework Mappings": [
    {
      "frameworkId": "SATRE",
      "value": "Meta-Data Search and Discovery Application"
    },
    {
      "frameworkId": "ENTRUST Blueprint",
      "value": "Job Submission Service"
    }
  ]
}