{
  "Requirement ID": "R007",
  "Title": "Scalable infrastructure",
  "Description": "Computational resources need to be scalable to support analysis of large-scale genomics datasets and AI development as well as validation.",
  "Version": "MS8 - updated",
  "Status": "Baselined",
  "Priority": 2,
  "Source": "EOSC-ENTRUST Driver 1",
  "Rationale": "",
  "Category": "Federation, Usability, and Advanced Capabilities",
  "Clarification Notes": "",
  "Scope Attribution": "",
  "Related Requirements": [],
  "Framework Mappings": [
    {
      "frameworkId": "SATRE",
      "value": "End user computing"
    },
    {
      "frameworkId": "ENTRUST Blueprint",
      "value": "TRE - RAZ"
    }
  ]
}